{
  "schemaVersion": 2,
  "enabled": true,
  "skinId": "AuraToolsExp.Terrias_columbina_columbina.restore_colors",
  "targetCareerId": "Terrias_columbina_columbina",
  "name": "复原色彩",
  "author": "Aura",
  "preview": "Columbina.png",
  "assets": {
    "CareerImage": "Columbina.png",
    "Character": "Columbina.png",
    "Animation": "."
  }
}
